{
  "schema_version": "1.0",
  "message_id": "01JZR0CMD001",
  "device_id": "dev_01JZQXABCD",
  "sent_at": "2026-07-11T05:35:00Z",
  "expires_at": "2026-07-11T06:35:00Z",
  "type": "content.sync",
  "payload": {
    "bundle_version": "2026.07.11.2",
    "url": "https://objects.example.local/bundles/2026.07.11.2?sig=abc",
    "size_bytes": 2457600,
    "sha256": "e3b0c44298fc1c149afbf4c8996fb92427ae41e4649b934ca495991b7852b855"
  }
}
